id,gameId,authorSteamId,authorPlaytimeForever,authorPlaytimeAtReview,authorLastPlayed,language,review,votedUp,votesUp,votesFunny,weightedVoteScore,writtenDuringEarlyAccess,timestampCreated,timestampUpdated
219852046,20,76561198212121196,456,456,2026-03-01T02:49:33,english,"Variação interessante do CS. Quem curte o original, consegue se divertir também com esse mod.",True,1,0,0.5,False,2026-03-05T04:18:01,2026-03-05T04:18:01
215316635,20,76561198072425370,320,262,2026-01-10T01:52:22,english,"its goldsrc, lots of jank, lots of fun

ngl i kinda like this after playing it for a couple hours, and suprisingly theres always atleast 1-3 servers alive",True,1,0,0.5,False,2026-01-06T15:19:51,2026-01-06T15:19:51
214969171,20,76561198755967300,70,27,2026-01-18T02:48:58,english,"It was fun but my screen got small whenever I used it
",True,0,0,0.5,False,2026-01-03T00:55:18,2026-01-03T00:55:18
217511897,20,76561198157047316,104,104,2021-07-15T04:29:34,english,"""Called and spoke with Adobe customer support and the guy told me Adobe is discontinuing Animate because apparently the company can't think of any new features to add to the program and they feel it's just gotten stale."" - Kris Dobbins

Meanwhile Team Fortress Classic is still up on Steam after all these years.",True,1,1,0.5,False,2026-02-03T20:34:56,2026-02-03T20:34:56
214172897,20,76561198271067137,3758,2079,2026-01-31T05:38:27,english,"Dead game, toxic community",False,2,1,0.4444444477558136,False,2025-12-25T19:38:54,2025-12-25T20:52:15
215520567,20,76561199811704721,1017,1014,2026-01-09T00:37:13,english,"Less complex then tf2 but still really fun
",True,2,0,0.54356849193573,False,2026-01-09T00:28:30,2026-01-09T00:28:30
217427827,20,76561199570383257,119,109,2026-02-02T16:24:46,english,Good way to increase skill and knowledge in Team Fortress Two.,True,0,0,0.5,False,2026-02-02T16:14:20,2026-02-02T16:14:20
218334461,20,76561199869483647,205,201,2026-02-28T23:40:50,english,Honestly glad to see some people still play the original,True,0,0,0.5,False,2026-02-14T23:17:09,2026-02-14T23:17:09
216764684,20,76561198254259783,250,250,2025-11-09T21:58:05,english,This is a certified fortress classic,True,2,0,0.5081967115402222,False,2026-01-25T12:57:45,2026-01-25T12:57:45
217000194,20,76561199845673891,186,98,2026-03-08T02:55:02,english,If fortress forever was was made on the gold source engine,True,0,0,0.5,False,2026-01-28T06:05:04,2026-01-28T06:05:04
216980883,20,76561198022186523,301614,301567,2026-03-06T19:46:57,english,"What a game, it's dope af,   and sexy",True,0,0,0.49180325865745544,False,2026-01-27T23:35:21,2026-01-27T23:35:21
215162655,20,76561198283194298,61210,242,2026-03-08T07:20:59,english,"it's great, they should make a sequel.",True,5,3,0.5824706554412842,False,2026-01-04T21:54:58,2026-01-04T21:54:58
214191325,20,76561199571848755,61,59,2025-12-29T01:52:44,english,servers are mainly just bots but its really fun,True,0,0,0.5,False,2025-12-25T23:42:24,2025-12-25T23:42:24
217712723,20,76561197970345753,990,986,2026-02-06T18:46:34,english,This classic never gets dated.,True,0,0,0.5,False,2026-02-06T18:43:19,2026-02-06T18:43:19
214772062,20,76561199589252817,12,12,2025-12-31T23:28:33,english,a mod for the 1996 game Quake.,True,0,0,0.5,False,2025-12-31T23:30:11,2025-12-31T23:30:11
213883188,20,76561199577455650,754,193,2026-02-13T18:50:44,english,It's Team Fortress Classic.,True,1,0,0.523809552192688,False,2025-12-22T04:22:43,2025-12-22T04:22:43
217460996,20,76561198765913771,797,231,2026-02-22T22:48:13,english,"A fun game from the Late 90's
",True,0,0,0.5,False,2026-02-03T01:43:57,2026-02-03T01:43:57
213607251,20,76561198142578940,14,14,2025-08-15T20:06:14,english,A legendary game was born,True,0,0,0.5,False,2025-12-19T02:17:51,2025-12-19T02:17:51
214221975,20,76561199238105698,102,102,2025-12-23T06:51:46,english,quake with mp5 and he grenades mmmmmmm,True,0,0,0.5,False,2025-12-26T09:26:02,2025-12-26T09:26:02
216996974,20,76561199205830763,213,213,2024-08-05T07:04:33,english,TF2 is better and not as dead,False,2,2,0.40449437499046326,False,2026-01-28T04:51:57,2026-01-28T04:51:57
214171553,20,76561198347606414,359,359,2025-12-25T22:26:21,english,almost as good as gnome jigsaw puzzles,True,0,0,0.5,False,2025-12-25T19:21:38,2025-12-30T23:14:30
216177474,20,76561198988585880,7,7,2026-01-01T00:32:26,english,please add headcrab gun,True,0,0,0.49450552463531494,False,2026-01-17T17:57:19,2026-01-17T17:57:19
216422538,20,76561199117850240,22,22,2024-02-21T15:22:40,english,This video game is very good!,True,2,0,0.5308057069778442,False,2026-01-20T19:36:13,2026-01-20T19:36:13
217938506,20,76561198396489444,122,122,2026-02-05T15:24:21,english,now this is a mann co merc's team fortress,True,0,0,0.5,False,2026-02-09T15:15:18,2026-02-09T15:15:18
214710538,20,76561199066264066,162,138,2026-01-25T06:17:10,english,this game is a classic,True,0,0,0.5,False,2025-12-31T06:54:37,2025-12-31T06:54:37
218912233,20,76561197961561020,69673,69651,2026-03-01T23:15:03,english,Been playing for over 25 years,True,2,0,0.5454545617103577,False,2026-02-22T01:49:03,2026-02-22T01:49:03
213810527,20,76561199470823026,158,158,2025-12-20T18:53:34,english,Classic PvP game.,True,1,0,0.523809552192688,False,2025-12-21T11:25:46,2025-12-21T11:25:46
214116481,20,76561198791912330,1629,1191,2026-03-04T01:28:59,english,I love this game so much,True,0,0,0.5,False,2025-12-25T03:27:39,2025-12-25T03:27:39
217671154,20,76561199654103828,208,95,2026-03-07T19:30:07,english,fun game,True,0,0,0.5,False,2026-02-06T04:20:32,2026-02-06T04:20:32
215158159,20,76561199746969517,222,212,2026-03-09T22:49:44,english,its a classic,True,0,0,0.5,False,2026-01-04T21:09:29,2026-01-04T21:09:29
214879992,20,76561199559408541,2016,1809,2026-01-18T22:30:52,english,Fun game,True,0,0,0.5,False,2026-01-02T03:50:57,2026-01-02T03:50:57
214041766,20,76561199573433585,729,714,2025-12-25T03:31:29,english,Very fun,True,0,0,0.5,False,2025-12-24T00:46:28,2025-12-24T00:46:28
217667884,20,76561199689542093,50,50,2025-11-18T00:52:34,english,"Fun game, just dead.",True,0,0,0.44342508912086487,False,2026-02-06T03:03:56,2026-02-06T03:03:56
215055856,2800,76561198048496394,6564,2715,2026-01-18T08:35:33,english,"have the original disk as well as steam version. a good fun game and time sink. Bad thing it wasnt made for win 11. Occasional crashes on the video cutscenes.  Tip, ddont give up try to take a run at it from diff gates and directions to avoid crashes. On the paranid quest at priest rings i turned on Video record in options and poof i got past the repeated crash on exiting the station. After you buy the goods from the paranid agent and attempt to leave station it goes to a cutscene and crashes. turn on video record ingame and jope it helps you like it helped me.  Anyhows its a great time killer and too bad you cant turn off the Kaak. They murder your transports and its annoying.",True,1,0,0.52173912525177,False,2026-01-03T21:38:22,2026-01-03T21:44:46
217921116,2800,76561198367471798,850,850,2026-02-08T23:13:55,english,"X2: The Threat, developed and published by Egosoft, represents a significant evolution of the sandbox space simulation formula established in X: Beyond the Frontier. Expanding both the narrative scope and the systemic complexity of its predecessor, X2 invites players into a vast, interconnected universe where trading, combat, exploration, and empire-building coexist within a living economic framework. Rather than presenting a tightly scripted experience, the game embraces player freedom, offering a universe that operates independently of the player’s immediate actions and rewarding long-term planning over short bursts of action.

Set once again in the X-Universe, the story follows Julian Gardna, whose personal journey becomes entangled with the emergence of a mysterious and aggressive alien race known as the Khaak. The narrative provides structure and occasional urgency, especially during key missions that advance the plot. However, like many sandbox simulations, the storyline is optional in spirit if not in design. Players can follow the narrative threads at their own pace or temporarily ignore them in favor of building wealth, exploring uncharted sectors, or assembling fleets. The game’s real strength lies not in its cinematic storytelling but in its capacity to support player-defined goals within a sprawling galactic economy.

The economic system is the beating heart of X2: The Threat. Every station, factory, and ship participates in a dynamic supply-and-demand network. Prices fluctuate based on production levels and consumption rates, creating opportunities for savvy traders to buy low and sell high across dozens of sectors. Early in the game, players often start with modest ships and limited cargo capacity, forcing careful planning of trade routes. As profits accumulate, options expand—larger freighters can be purchased, automated trading ships can be assigned to generate passive income, and eventually entire industrial complexes can be constructed. This gradual progression from small-scale merchant to interstellar magnate is one of the game’s most satisfying arcs.

Combat in X2 adds another layer of depth, though it is rarely the sole focus. The universe contains pirates, hostile factions, and the looming Khaak threat, each capable of disrupting trade routes or attacking vulnerable assets. Players can outfit ships with a variety of weapons, shields, and upgrades, customizing their vessels for defense or offense. While dogfighting can feel less refined than dedicated space combat simulators, strategic fleet management compensates for this. Owning multiple ships and coordinating their deployment across sectors introduces a grander tactical dimension. Large-scale engagements involving capital ships and carriers create moments of spectacle, particularly when defending valuable infrastructure from enemy incursions.

The scale of the universe is impressive, comprising well over a hundred sectors connected by jump gates. Each region has its own economic profile, faction presence, and environmental character. Some sectors teem with trade opportunities, while others are dangerous frontiers patrolled by aggressive forces. Exploration feels purposeful, as uncovering new sectors often reveals lucrative trade possibilities or strategic locations for station construction. The sense of space is reinforced by ambient sound design and the relative isolation of deep-sector travel, contributing to immersion even when gameplay unfolds at a deliberate pace.

Despite its ambition, X2: The Threat demands patience. The interface, while improved over its predecessor, remains dense and occasionally unintuitive. Navigating menus, configuring ships, and managing multiple assets can feel overwhelming for newcomers. The early hours are especially slow, as players work within tight financial constraints and limited ship capabilities. Yet this slow start is intentional, mirroring the climb from obscurity to influence. The game rewards persistence; mastering its systems transforms complexity into empowerment.

Visually, X2 offered notable improvements at the time of release, with enhanced ship models, atmospheric nebulae, and more detailed station designs. While modern standards may reveal the age of its graphics engine, the aesthetic still conveys a sense of scale and cosmic vastness. Ship interiors and menus are functional rather than flashy, reinforcing the simulation-driven focus. The soundtrack and ambient audio contribute to the mood without dominating the experience, allowing players to settle into the rhythms of space commerce and exploration.

Ultimately, X2: The Threat stands as a defining chapter in Egosoft’s space simulation lineage. It successfully broadens the sandbox concept by layering narrative, economic depth, and fleet management into a cohesive universe. It may not offer immediate gratification or streamlined accessibility, but its systemic richness provides enduring appeal. For players who relish autonomy, complex economic systems, and the gradual construction of a personal interstellar empire, X2 delivers a rewarding and expansive journey through the stars.

Rating: 8/10",True,0,0,0.5,False,2026-02-09T07:39:23,2026-02-09T07:39:23
214859102,2800,76561197967176901,36,36,2023-01-01T19:37:54,english,"This would be a mixed review (had to refund).

Relic from the before times when Egosoft could fit all factions and music in a game without DLC...

One of my favourites in the franchise as had a lot of character to each faction. Played hundreds of hours in my childhood.

It is probably the most accessible introduction to the X series, later games are even more of a UI hellscape than this.

Unfortunately couldn't get this to run without constant crashing. Multiple issues with audio and the in-game video / cutscene playback. Couldn't even make it through the intro & tutorial.",True,0,0,0.4761904776096344,False,2026-01-01T22:49:09,2026-01-02T23:45:33
215055856,2800,76561198048496394,6564,2715,2026-01-18T08:35:33,english,"have the original disk as well as steam version. a good fun game and time sink. Bad thing it wasnt made for win 11. Occasional crashes on the video cutscenes.  Tip, ddont give up try to take a run at it from diff gates and directions to avoid crashes. On the paranid quest at priest rings i turned on Video record in options and poof i got past the repeated crash on exiting the station. After you buy the goods from the paranid agent and attempt to leave station it goes to a cutscene and crashes. turn on video record ingame and jope it helps you like it helped me.  Anyhows its a great time killer and too bad you cant turn off the Kaak. They murder your transports and its annoying.",True,1,0,0.52173912525177,False,2026-01-03T21:38:22,2026-01-03T21:44:46
217921116,2800,76561198367471798,850,850,2026-02-08T23:13:55,english,"X2: The Threat, developed and published by Egosoft, represents a significant evolution of the sandbox space simulation formula established in X: Beyond the Frontier. Expanding both the narrative scope and the systemic complexity of its predecessor, X2 invites players into a vast, interconnected universe where trading, combat, exploration, and empire-building coexist within a living economic framework. Rather than presenting a tightly scripted experience, the game embraces player freedom, offering a universe that operates independently of the player’s immediate actions and rewarding long-term planning over short bursts of action.

Set once again in the X-Universe, the story follows Julian Gardna, whose personal journey becomes entangled with the emergence of a mysterious and aggressive alien race known as the Khaak. The narrative provides structure and occasional urgency, especially during key missions that advance the plot. However, like many sandbox simulations, the storyline is optional in spirit if not in design. Players can follow the narrative threads at their own pace or temporarily ignore them in favor of building wealth, exploring uncharted sectors, or assembling fleets. The game’s real strength lies not in its cinematic storytelling but in its capacity to support player-defined goals within a sprawling galactic economy.

The economic system is the beating heart of X2: The Threat. Every station, factory, and ship participates in a dynamic supply-and-demand network. Prices fluctuate based on production levels and consumption rates, creating opportunities for savvy traders to buy low and sell high across dozens of sectors. Early in the game, players often start with modest ships and limited cargo capacity, forcing careful planning of trade routes. As profits accumulate, options expand—larger freighters can be purchased, automated trading ships can be assigned to generate passive income, and eventually entire industrial complexes can be constructed. This gradual progression from small-scale merchant to interstellar magnate is one of the game’s most satisfying arcs.

Combat in X2 adds another layer of depth, though it is rarely the sole focus. The universe contains pirates, hostile factions, and the looming Khaak threat, each capable of disrupting trade routes or attacking vulnerable assets. Players can outfit ships with a variety of weapons, shields, and upgrades, customizing their vessels for defense or offense. While dogfighting can feel less refined than dedicated space combat simulators, strategic fleet management compensates for this. Owning multiple ships and coordinating their deployment across sectors introduces a grander tactical dimension. Large-scale engagements involving capital ships and carriers create moments of spectacle, particularly when defending valuable infrastructure from enemy incursions.

The scale of the universe is impressive, comprising well over a hundred sectors connected by jump gates. Each region has its own economic profile, faction presence, and environmental character. Some sectors teem with trade opportunities, while others are dangerous frontiers patrolled by aggressive forces. Exploration feels purposeful, as uncovering new sectors often reveals lucrative trade possibilities or strategic locations for station construction. The sense of space is reinforced by ambient sound design and the relative isolation of deep-sector travel, contributing to immersion even when gameplay unfolds at a deliberate pace.

Despite its ambition, X2: The Threat demands patience. The interface, while improved over its predecessor, remains dense and occasionally unintuitive. Navigating menus, configuring ships, and managing multiple assets can feel overwhelming for newcomers. The early hours are especially slow, as players work within tight financial constraints and limited ship capabilities. Yet this slow start is intentional, mirroring the climb from obscurity to influence. The game rewards persistence; mastering its systems transforms complexity into empowerment.

Visually, X2 offered notable improvements at the time of release, with enhanced ship models, atmospheric nebulae, and more detailed station designs. While modern standards may reveal the age of its graphics engine, the aesthetic still conveys a sense of scale and cosmic vastness. Ship interiors and menus are functional rather than flashy, reinforcing the simulation-driven focus. The soundtrack and ambient audio contribute to the mood without dominating the experience, allowing players to settle into the rhythms of space commerce and exploration.

Ultimately, X2: The Threat stands as a defining chapter in Egosoft’s space simulation lineage. It successfully broadens the sandbox concept by layering narrative, economic depth, and fleet management into a cohesive universe. It may not offer immediate gratification or streamlined accessibility, but its systemic richness provides enduring appeal. For players who relish autonomy, complex economic systems, and the gradual construction of a personal interstellar empire, X2 delivers a rewarding and expansive journey through the stars.

Rating: 8/10",True,0,0,0.5,False,2026-02-09T07:39:23,2026-02-09T07:39:23
214859102,2800,76561197967176901,36,36,2023-01-01T19:37:54,english,"This would be a mixed review (had to refund).

Relic from the before times when Egosoft could fit all factions and music in a game without DLC...

One of my favourites in the franchise as had a lot of character to each faction. Played hundreds of hours in my childhood.

It is probably the most accessible introduction to the X series, later games are even more of a UI hellscape than this.

Unfortunately couldn't get this to run without constant crashing. Multiple issues with audio and the in-game video / cutscene playback. Couldn't even make it through the intro & tutorial.",True,0,0,0.4761904776096344,False,2026-01-01T22:49:09,2026-01-02T23:45:33
219904333,2810,76561198042657559,15268,15253,2026-03-13T01:31:09,english,"The first of the X3 series. It is a good game... but imo it is far exceeded by the subsequent games in the series... Terran Conflict, Albion Prelude & Farnham's Legacy.",True,0,0,0.5,False,2026-03-05T19:35:55,2026-03-05T19:35:55
218355307,2810,76561197971330688,2077,2066,2026-02-18T02:15:19,english,"this is a classic space simulator. in some ways, it's superior to x4 in that ftl jump drives make interstellar travel easier than the stupid highway system in x4. in some ways, the ships are better too. i wish a graphic enhancement pack would be released, or a remaster. but this game is peak mid-2000's space sim.",True,0,0,0.5,False,2026-02-15T06:00:29,2026-02-15T06:00:29
219904333,2810,76561198042657559,15268,15253,2026-03-13T01:31:09,english,"The first of the X3 series. It is a good game... but imo it is far exceeded by the subsequent games in the series... Terran Conflict, Albion Prelude & Farnham's Legacy.",True,0,0,0.5,False,2026-03-05T19:35:55,2026-03-05T19:35:55
218355307,2810,76561197971330688,2077,2066,2026-02-18T02:15:19,english,"this is a classic space simulator. in some ways, it's superior to x4 in that ftl jump drives make interstellar travel easier than the stupid highway system in x4. in some ways, the ships are better too. i wish a graphic enhancement pack would be released, or a remaster. but this game is peak mid-2000's space sim.",True,0,0,0.5,False,2026-02-15T06:00:29,2026-02-15T06:00:29
216494843,2810,76561198076378579,20,20,2026-01-21T20:47:29,english,It has not aged well. There is no tutorial and the ship is difficult to maneauver. I quit after 20 minutes. 20/100,False,0,0,0.47826087474823,False,2026-01-21T20:50:02,2026-01-21T20:50:02
214990366,2810,76561198349677633,1106,1106,2026-01-03T06:58:48,english,"amazing game, speedrunned all the scenarios quickly, first time playing. hahaha have fun",True,0,0,0.46666666865348816,False,2026-01-03T06:36:14,2026-01-03T06:36:14
215438038,2810,76561197991923110,3616,3616,2017-04-18T04:06:19,english,You really need to have lots of patience and imagination to enjoy it,False,1,1,0.4921337366104126,False,2026-01-07T23:40:01,2026-01-07T23:40:01
213770034,2810,76561197970539229,13,13,2025-12-20T23:32:11,english,Played this nearly 20 years ago and I have fond memories.,True,1,0,0.5086393356323242,False,2025-12-20T23:36:46,2025-12-20T23:36:46
219904333,2810,76561198042657559,15268,15253,2026-03-13T01:31:09,english,"The first of the X3 series. It is a good game... but imo it is far exceeded by the subsequent games in the series... Terran Conflict, Albion Prelude & Farnham's Legacy.",True,0,0,0.5,False,2026-03-05T19:35:55,2026-03-05T19:35:55
218355307,2810,76561197971330688,2077,2066,2026-02-18T02:15:19,english,"this is a classic space simulator. in some ways, it's superior to x4 in that ftl jump drives make interstellar travel easier than the stupid highway system in x4. in some ways, the ships are better too. i wish a graphic enhancement pack would be released, or a remaster. but this game is peak mid-2000's space sim.",True,0,0,0.5,False,2026-02-15T06:00:29,2026-02-15T06:00:29
216494843,2810,76561198076378579,20,20,2026-01-21T20:47:29,english,It has not aged well. There is no tutorial and the ship is difficult to maneauver. I quit after 20 minutes. 20/100,False,0,0,0.47826087474823,False,2026-01-21T20:50:02,2026-01-21T20:50:02
214990366,2810,76561198349677633,1106,1106,2026-01-03T06:58:48,english,"amazing game, speedrunned all the scenarios quickly, first time playing. hahaha have fun",True,0,0,0.46666666865348816,False,2026-01-03T06:36:14,2026-01-03T06:36:14
215438038,2810,76561197991923110,3616,3616,2017-04-18T04:06:19,english,You really need to have lots of patience and imagination to enjoy it,False,1,1,0.4921337366104126,False,2026-01-07T23:40:01,2026-01-07T23:40:01
213770034,2810,76561197970539229,13,13,2025-12-20T23:32:11,english,Played this nearly 20 years ago and I have fond memories.,True,1,0,0.5086393356323242,False,2025-12-20T23:36:46,2025-12-20T23:36:46
218785157,2820,76561198001039840,15301,15295,2026-02-20T17:36:14,english,wonderfully detailed,True,0,0,0.4761904776096344,False,2026-02-20T17:22:17,2026-02-20T17:22:17
217586858,2820,76561198141061985,16,16,2026-02-04T22:45:37,english,"This has got to be some sort of joke. This does NOT have controller support despite literally showing a controller schematic in game. Also, no idea how to turn the music down (tried many different ways in volume music but nothing worked 🙃) which would be REALLY nice because someone decided the music is vastly more important to hear than whatever the narrator is trying to say. Literally can’t hear what they’re saying at all.",False,1,2,0.5243619084358215,False,2026-02-04T22:50:32,2026-02-04T22:50:32
213321839,2820,76561198390037981,11622,11613,2025-12-31T21:32:42,english,"DO NOT TRY TO PLAY THIS GAME ON STEAM.  They offer almost no support.  This game is Buggy as hell.  The game maker knows this and they have posted about 6 mods and fixes.  Each one of those mods and fixes says: ""This will not work with Steam. ""  About 100 hours into the game you discover it is broken.  I asked for a refund but Steam said ""Uh... you have already played 100 hours.  Yes. I wanted 100 hours on a game that worked.  You can take my refund and shove it Steam.   Buy the game online by a reputable dealer.",False,13,9,0.5186784863471985,False,2025-12-15T01:50:04,2025-12-15T01:50:04
213183653,2820,76561198089072911,145,103,2025-12-13T12:58:36,english,"what I don't like about X games is that sometimes you just have to grind through boring stuff x(

but it's a great game non the less",True,1,0,0.5161290764808655,False,2025-12-13T10:53:35,2025-12-13T10:53:35
216498776,2820,76561198076378579,16,16,2026-01-21T21:54:21,english,This is almost identical to the first game with the same problems of having aged poorly. The ship controls are very difficult to use and there is no tutorial. 20/100,False,0,1,0.5,False,2026-01-21T21:56:31,2026-01-21T21:56:31
