id,gameId,authorSteamId,authorPlaytimeForever,authorPlaytimeAtReview,authorLastPlayed,language,review,votedUp,votesUp,votesFunny,weightedVoteScore,writtenDuringEarlyAccess,timestampCreated,timestampUpdated
218850809,10,76561198090354754,441784,427426,2026-03-13T10:16:22,english,"Counter-Strike is where it all started. Simple, raw, and purely skill-based. No fancy mechanics, no distractions — just aim, movement, map knowledge, and teamwork.

Every round feels intense, and even small plays can make a huge difference. The game rewards practice and experience more than almost any other shooter.

Even after all these years, Counter-Strike is still fun and incredibly competitive. A true classic that defined FPS games and will always have a special place in gaming history.",True,30,2,0.7394841909408569,False,2026-02-21T11:11:06,2026-02-21T11:11:06
219304915,10,76561198292458607,857,857,2026-02-24T19:12:33,english,"A classic. I'm in the younger generation of players for this game, my dad introduced me to it when I was five. Almost 20 years later and I've moved out and am studying at university about 150km away from my parents. I get to hang out with my dad through this game, which I think is pretty cool :)

Additionally, the game is good fun all around with it's many different gamemode servers. You have the classics like surf, gungame, zombie, kreedz and deathrun. I recently revisited the game and aside from the nostalgia blast of all the old maps, found out theres a warcraft gamemode too!! There's a corner for basically everyone in this game.",True,11,1,0.6508588194847107,False,2026-02-27T00:48:10,2026-02-27T00:48:10
218465196,10,76561198272554416,200,194,2026-02-16T16:55:25,english,"Counter-Strike 1.6 is more than just a game - it’s a memory, a feeling, a whole era. About 15 years ago, my friends and I used to gather in small internet cafes after school, packing into tight rooms full of noisy PCs, shouting across the tables, and connecting through a local network just to battle it out in cs. No fancy matchmaking, no skins, no battle passes - just pure competition and endless fun

What makes cs truly special is that time hasn’t killed it. Even after all these years, it remains a classic that refuses to fade away. The gameplay is simple, fast, and incredibly skill-based. Every round still feels tense, every clutch still makes your heart race and every headshot still feels earned. Modern shooters may look better, but very few feel this honest and raw

Even today, the community is alive. There are tons of servers running modes like war3ft, deathrun and Surf - and they are still insanely fun. Jumping into these servers instantly brings back that old-school vibe and a wave of nostalgia that modern games just can’t replicate. cs isn’t just remembered - it’s still played, still loved and still awesome. A true timeless legend",True,5,1,0.5759717226028442,False,2026-02-16T15:35:55,2026-02-16T15:35:55
219152411,10,76561198136975055,1493,1493,2026-02-24T22:12:15,english,"The Half-Life mod that changed the online FPS world forever.

It's actually a light tactical shooter where one team plays the terrorists with the objective to plant the bomb, and the other team the counter-terrorists with the objective to defuse the bomb, both teams having a plethora of weapons and gadgets on dispose.

A simple concept, but one that stood the test of time, as we can see in the refreshed versions of this game.

The OG C-S has a certain feel to it that is unique and not trully replicated again (although ""Condition Zero"" is very similar to it), I like how some weapons feel, the movement and everything.

It is still played and populated today, so you're free to check out some community servers, or make your own one and invite some friends over.

A classic ""evergreen"" title that also marked the gradual shift towards more realism-oriented shooters, opposed to purely fantasy/Sci-Fi arcade ones (which I also enjoy, but they're a different experience).",True,3,0,0.5705521106719971,False,2026-02-24T23:18:18,2026-02-24T23:18:18
218382325,10,76561199046391364,2403,2403,2026-01-16T02:19:10,english,"First game that my parents recommend me about FPS genre and nowdays, this masterpiece still keeps going and revolutionized games for decades. Thank you CS<3",True,1,1,0.5044247508049011,False,2026-02-15T14:41:05,2026-02-15T14:41:05
220473207,10,76561199095163741,72,72,2025-10-03T00:32:13,english,"Score: 9/10

I've played CS 1.6 a lot when I was a kid and it's been awesome, I have so many great memories and it was so much fun to just open up the game, find a good server and play a lot! It was way more smooth and enjoyable to me compared to the counter strike we have nowadays, it's way more serious, heavy with skins and a lot of bad stuff and less fun most of the time, more of a frustration but the original CS was different and that's why it will always be a game we will remember once someone mentions Counter Strike.",True,0,0,0.5,False,2026-03-12T06:41:59,2026-03-12T06:41:59
220382048,10,76561198056671008,4091,4091,2025-12-14T15:01:03,english,The Spirit of Steam. (The S.O.S. of this 22 year-old gaming library/museum in some cases) xD,True,0,0,0.5,False,2026-03-10T23:20:58,2026-03-10T23:20:58
220138404,10,76561199076481015,1313,1302,2026-03-10T07:00:04,english,"It's a good game, I hope in 25 years they release a ♥♥♥♥♥♥ sequel with broken hitreg and remove all the content and maps from previous versions as a front for this series turning into a casino",True,0,0,0.5,False,2026-03-08T02:21:06,2026-03-08T02:21:06
220101529,10,76561197982007591,6921,6845,2026-03-07T19:42:28,english,"It was good before valve invented steam. You shared cd with a friend. you played it with computer rooms in schools, you played it after school with friends, good ol times.
",True,0,0,0.5,False,2026-03-07T18:23:41,2026-03-07T18:23:41
220068805,10,76561197962333200,5633,5633,2023-09-29T21:44:00,english,"Perfect game! 
*all can play it on potato+crt and still feel like 0.005ms delay
*no skins to buy, instead you download it for free and get kicked online if you use them *PERFECT WORLD*
*game responds so fast it's like a dream in your mind, don't get stuck there! 
*remember to eat and drink inbetween sessions to stay alive irl!",True,0,1,0.5,False,2026-03-07T11:39:09,2026-03-07T11:39:09
219996659,10,76561199099650135,106,100,2026-03-07T06:13:41,english,"Nostalgia, just remembering when i was a kid and my favorite game was cs, i played it every day only vs bots, but at least i was happy :tobdog:",True,0,0,0.5,False,2026-03-06T17:53:44,2026-03-06T17:55:35
219860433,10,76561199785659433,1976,1976,2026-02-15T08:02:35,english,The final version of Counter-Strike not gonna  lie the movement (hop peek thing) is better then other cs game its faster to peek and it feels like a new meta. New generation like Gen alpha and gen z will hate the game why? Because they only hate the graphics due to low textures I don't understand why they hate the graphics even tho it's a 2000 game.,True,0,0,0.5,False,2026-03-05T07:19:06,2026-03-05T07:19:06
219764936,10,76561199040172525,6149,6149,2023-10-22T23:58:44,english,"Timeless classic, 2nd best Counter-Strike after CS:GO. It will outlive all of us and it will still be played.",True,0,0,0.5,False,2026-03-04T05:05:32,2026-03-04T05:05:32
219674839,10,76561197962273784,185,185,1970-01-02T01:00:00,english,"I remember my friend gifting me Half Life from the CD that game with his dad's new GPU. We both played Half Life and eventually discovered CS. We played it a lot, and eventually Steam came around with its olive drab UI and CS 1.6.

Incredible time for gaming. My Steam account is about that old. Had to get Steam to keep pwning noobs on de_rats man.",True,0,0,0.5,False,2026-03-03T01:35:56,2026-03-03T01:35:56
219460844,10,76561198794782086,8805,7639,2026-03-12T03:06:45,english,Is good game cs steam there much fps and  no lagging,True,0,0,0.5,False,2026-02-28T18:30:33,2026-02-28T18:30:33
219439469,10,76561199171063106,136,136,2026-02-25T23:04:58,english,i wish there was workshop content and also more community servers that do competitive matches. i dont want to always be playing wacky casual matches with double jump and free AWPs every match with 32 players. I want a competitive experience.,True,0,0,0.5,False,2026-02-28T14:17:24,2026-02-28T14:17:24
219328857,10,76561197974101766,121,121,2026-02-26T13:08:02,english,"Bullets bounce like rubber balls, and teammates hug like penguins in tuxedos, and victory tastes like victory cake!",True,0,1,0.5,False,2026-02-27T09:31:43,2026-02-27T09:31:43
219182935,10,76561199172242097,644,644,2026-02-05T05:44:29,english,"This game is pure nostalgia for me. No crazy mechanics, just aim, reflex and team play. Even after so many years, it’s still fun and competitive. Simple but legendary.

Still one of the best FPS games ever made.",True,0,0,0.5,False,2026-02-25T10:13:47,2026-02-25T10:13:47
219038916,10,76561197963509451,17503,17226,2026-02-23T18:34:50,english,"CS 1.6 is pure classic CS. No crazy graphics, no extra mechanics just raw skill, aim, and game sense. The movement feels fast, the gunplay is simple but rewarding, and every round can turn into an intense clutch.

Even after so many years, the game is still fun to play, especially on community servers. Of course, it feels old compared to modern shooters, and the graphics and matchmaking are outdated, but that’s part of the charm.

Pros: simple and skill-based gameplay, nostalgic vibe, smooth movement
Cons: outdated graphics, old matchmaking system

Overall, CS 1.6 is legendary. If you grew up with it, you already know. If not, it’s still worth trying just to experience classic CS at its best.
",True,0,0,0.5,False,2026-02-23T13:57:50,2026-02-23T13:57:50
219012256,10,76561199093809080,301,301,2026-02-23T04:08:17,english,"If you like CS2, you'll like this game. 
If you like Half-Life, you'll like this game
If you like old school shooters, you'll like this game.
If you like chatting with wise dudes, you'll like this game.
if you like cheap games with a consistent player base, you'll like this game
If you like having a great time, buy this game.",True,0,0,0.5,False,2026-02-23T04:11:21,2026-02-23T04:11:21
218951071,10,76561198208150792,2444,60,2026-03-11T20:29:09,english,"Playing this game since few yrs old, guessing played 3-5K hrs in my youth
Amazing game play with different funny mode and mod
Totally skill-based PVP competitive FPS game without Pay-To-Win/Hours-Farming content
Complete fairness team-play shooter Game
The only thing to growth is yourself and the basis
Chill and Relax servers as well :D Enjoy!",True,0,0,0.5,False,2026-02-22T13:47:00,2026-02-22T13:47:00
218861024,10,76561198194386866,2850,2850,2026-02-23T16:35:39,english,The Best childhood shooting game Ive ever played and Btw I played it when I was a kid But one problem I cannot find a server with Less ping  and all of them Have High Ping.,True,0,0,0.5,False,2026-02-21T14:04:49,2026-03-11T20:14:23
218756023,10,76561198402037810,6198,6085,2026-03-08T21:56:40,english,"Best Counter-Strike ever, no doubts. Simple, fun, super alive full of people and enjoyable. Besides, even a potato runs this! Playing for almost a decade, never got tired of this. I recommend a lot!",True,0,0,0.5,False,2026-02-20T08:22:12,2026-02-20T08:22:12
218493829,10,76561199522529626,67,67,2025-11-02T12:48:08,english,A classic nostalgic game which is still very well relevant today. Even in the big 2026 one can enjoy this game to the fullest.,True,0,0,0.5,False,2026-02-16T22:42:41,2026-02-16T22:42:41
218067973,10,76561198813852092,21087,21087,2025-12-20T10:18:04,english,One of the best childhood game i ever play. Never knew if the original doesnt have the music or bots.,True,0,0,0.5,False,2026-02-11T11:55:20,2026-02-11T11:55:20
219305606,10,76561198014550943,6321,6321,2026-02-27T01:02:22,english,bunch of fake servers w fake ping fake player count... maybe even a virus,False,6,0,0.54347825050354,False,2026-02-27T01:03:42,2026-02-27T01:03:42
218208084,10,76561198034929602,615,615,2026-02-11T22:33:11,english,"It lags and stutters on my system, Volvo please optimize your game",True,0,1,0.47999998927116394,False,2026-02-13T11:33:19,2026-02-13T11:33:19
220499044,10,76561199213379600,12,12,2025-11-06T18:14:52,english,"yo this game looks too old like im playing it from nintendo 64, also why is it so skibidi toilet? like seriously, why does it look like skibidi toilet in low budget? you should update it now",False,0,3,0.4545454680919647,False,2026-03-12T16:37:19,2026-03-12T16:37:19
218947344,10,76561198022292842,60001,60001,2026-02-22T12:43:50,english,"Absolutely Not Recommended

I genuinely cannot stand Counter-Strike (2000). I don’t care how “legendary” people say it is - being old and influential doesn’t magically make it good.

This game feels like a museum exhibit that someone forgot to retire. The movement is clunky, the gunplay feels like it was designed to punish you personally, and the recoil system is less “skill-based” and more “memorize this invisible nonsense or suffer.” It’s not intuitive. It’s not welcoming. It’s not fun.

The graphics look like they were assembled out of leftover cardboard, the animations are stiff, and the sound design is so flat it might as well be placeholder audio that accidentally shipped. Every match feels less like tactical depth and more like getting instantly deleted by someone who has been practicing the same two maps for the last 20 years.

There’s no meaningful onboarding, no quality-of-life features, and absolutely no forgiveness for new players. You don’t “learn” the game - you endure it. And if you’re not already part of the nostalgia club, you’re just cannon fodder for veterans who treat public lobbies like their personal highlight reel.

People call it hardcore. I call it outdated and painfully overrated.

Respect its historical impact if you want.
Playing it in 2026? Miserable.",False,2,2,0.45417577028274536,False,2026-02-22T12:50:37,2026-02-22T12:50:37
220417804,10,76561199849014322,81,26,2026-03-12T14:59:05,english,"хоть тут я мало наиграл могу сказать что эта игра самая лучшая в которую можно поиграть самому так и с друзьями. Тут не надо донатить(если конечно не покупать вип на серверах), так же мне понравилось что тут хоть и по графике отстает кс 1.6 зато по всему этому вообще идеальна игра, и она даже как по мне лучше кс 2. Все что хочу наверное тут написать так это то что не зря потратил деньги на оффициальную кс 1.6 и вообще я советую ее покупать",True,0,0,0.5,False,2026-03-11T13:33:07,2026-03-11T13:33:07
220346550,10,76561199140871234,21,21,2026-03-10T12:12:20,english,"«Counter-Strike 1.6 was the best game of its time and, honestly, the best in the entire history of the franchise for me personally. Highly recommend!»",True,0,0,0.5,False,2026-03-10T14:00:35,2026-03-10T14:00:35
220141643,10,76561198026969528,69,69,2020-05-23T18:44:03,english,"I remember when I didn't have responsibilities... Switched from playing 4 years of Quake 3 to CS 1.6 back in 2007-2008... I was too young to even remember my old Steam account log-in. Back then, Valve didn't track how many hours of gaming we accumulated. Not until like 2010, I think?? LOL. I think Xfire might have though, but it's been too long to remember. I still love watching old 1.6 videos when people would record their gameplay using FRAPS. Bring me back to good ole 1.6 days again.",True,0,0,0.5,False,2026-03-08T03:14:35,2026-03-08T03:14:35
219993848,10,76561199812158303,75,75,2026-02-16T04:52:49,english,"I tried playing this with my dad, he didn't give a ♥♥♥♥ and couldn't make it out of spawn lmao

Source is better I'm just saying",True,0,0,0.5,False,2026-03-06T17:21:30,2026-03-06T17:21:30
220192766,10,76561199036738197,8,8,2026-01-09T20:37:06,english,"very bad no play with bots and no volvo matchmakin, also no schwarzenegev. dont buy by any means",True,0,0,0.4945652186870575,False,2026-03-08T16:25:08,2026-03-08T16:25:08
218443144,10,76561199071377338,200,200,2026-02-16T06:59:55,english,Just straight up not a good game. It was probably great back in the 90's and 00's but it just sucks now,False,0,0,0.43970686197280884,False,2026-02-16T07:00:55,2026-02-16T07:00:55
218305043,10,76561198799628542,61,49,2026-02-14T16:31:20,english,"The oldest and obviously the clunkiest version of cs.
Cant really think of a reason to play this version instead of just cs2, since its free regardless.
Unlike the source version where i actually had some fun playing it, this was just a meh experience.
Yes its a classic, but for todays standarts I just cant recommend it.",False,0,1,0.43478259444236755,False,2026-02-14T16:27:37,2026-02-14T16:27:37
219185295,10,76561198009546681,236,236,2024-10-12T21:41:24,english,"do not give money to valve you do not own your games you own a liscense
do not buy 
the steam deck
steam machine 
or any products from any megacorporation
they are all owned by satan
",False,3,2,0.48447203636169434,False,2026-02-25T11:11:49,2026-02-25T11:11:49
219787192,10,76561198026834782,147927,147677,2026-03-12T01:21:07,english,I like this game because of nostalgia and years of experience of playing.,True,0,0,0.5,False,2026-03-04T12:33:52,2026-03-04T12:33:52
220189353,10,76561198369845202,282,239,2026-03-09T19:00:47,english,"Greatest online video game of all time. Better than Counter Strike: Source, Counter Strike: Global Offensive and Counter Strike 2, COMBINED!!!!!!!!!!!!!!!!!!!!!!!!!!!!!!!!!!!!!!!!!!!!!!!!!!!!!",True,0,0,0.5,False,2026-03-08T15:44:37,2026-03-08T15:44:37
219242270,10,76561198375666559,445,445,2025-11-13T05:19:56,english,"the phantom, exterior like fish eggs, interior like suicide wrist-red, I could exercise you, this could be your phys-ed, cheat on your man homie",True,0,1,0.5,False,2026-02-26T04:18:10,2026-02-26T04:18:10
219033312,10,76561198877394917,1746,1746,2026-02-03T14:20:26,english,"Greatest FPS in history, tied with Half Life. GG Minh Lee and Jess Cliffe.",True,0,0,0.5,False,2026-02-23T12:11:15,2026-02-23T12:11:15
219885799,10,76561198095958987,256,242,2026-03-05T17:11:28,english,"The phantom, exterior like fish eggs
Interior like suicide-wrist red
I can exercise you, this can be your phys. ed
Cheat on your man homie
AHHH i tried to sneak through the door man
Can't make it, can't make it, this ♥♥♥♥'s stuck
OUTTA MY OWN SON, DOOR STUCK, DOOR STUCK
PLEASE, I BEG YOU, WE'RE DEAD
YOU'RE A GENUINE ♥♥♥♥♥♥♥♥♥♥♥",True,1,0,0.523809552192688,False,2026-03-05T15:31:22,2026-03-05T15:31:22
219366495,10,76561199706654085,886,703,2026-03-12T18:13:43,english,"CS 1.6: My Childhood. My Roots. 🕊️
Most kids grew up with toys; I grew up with a laptop. My mom gave me my first one when I was only 1 year old. By the time I was 4 or 5, I was already actively playing CS 1.6.
I wasn’t chasing headshots or trying to be a pro. I was just playing. I lived in those maps—the echoes of de_dust2, the tension of cs_mansion, and the classic radio commands. It was the simplest, purest part of my childhood.
I’m 16 now and finally here on Steam, but 1.6 will always be where it all started.
Thank you, 1.6, for the memories. A true legend never dies. ❤️",True,0,0,0.5,False,2026-02-27T19:14:12,2026-02-27T19:14:12
218935663,10,76561198051741638,1446,1437,2026-03-13T07:09:14,english,So fun but CS:S and CS:2 is probably more alive if you wanna play with people.,True,0,0,0.5,False,2026-02-22T09:26:01,2026-02-22T09:26:01
218361153,10,76561199277426977,29,29,2025-05-06T13:36:44,english,"unironically, the most influential game ever.",True,1,0,0.5,False,2026-02-15T08:14:09,2026-02-15T08:14:09
218217155,10,76561198105377406,90,57,2026-02-13T15:16:22,english,"Things truly were different. But not in a bad way. In fact, that's what makes this fun to look at.",True,1,0,0.5,False,2026-02-13T14:41:46,2026-02-13T14:42:25
220492028,10,76561199888199762,24,24,2026-03-10T11:06:12,english,"still has an active community after 26 years, that alone tells you all you need to know",True,0,0,0.5,False,2026-03-12T14:43:06,2026-03-12T14:43:06
220370158,10,76561198012695508,261030,260485,2026-03-12T21:56:01,english,"Is nice the game, i recomand the version of 1.6",True,0,0,0.5,False,2026-03-10T20:04:39,2026-03-10T20:04:39
219429926,10,76561199132416580,9405,8943,2026-03-01T21:25:17,english,old type of shooting game but still unbeaten ;d,True,0,0,0.5,False,2026-02-28T11:58:05,2026-02-28T11:58:05
218107325,10,76561199125295985,5314,261,2026-03-12T23:56:24,english,THE BEST FPS GAME EVER. Liker EVER FULLS STOP POSTING THIS IN 2026 after playing since childhood.,True,1,0,0.5,False,2026-02-11T23:20:53,2026-02-11T23:20:53
220107397,10,76561197990780950,160978,160978,2026-03-07T15:26:56,english,"its good no cheaters and fun
",True,0,0,0.5,False,2026-03-07T19:31:29,2026-03-07T19:31:29
218528346,10,76561198020254185,287,194,2026-03-09T20:24:40,english,really good cs game still holds up after 27 years,True,0,0,0.5,False,2026-02-17T11:40:50,2026-02-17T11:40:50
220063815,10,76561199051572962,7054,7054,2026-03-07T00:22:51,english,"a classic. one of my first ever ""computer"" game i played.",True,0,0,0.5,False,2026-03-07T10:23:02,2026-03-07T10:23:02
220042582,10,76561198852611578,36,36,2024-08-11T20:44:20,english,I don't remember getting this game but still pretty cool,True,0,0,0.5,False,2026-03-07T04:22:22,2026-03-07T04:22:22
220013465,10,76561198372231499,807,807,2025-08-09T02:00:15,english,"a classic lost in time,but never forgotten.",True,0,0,0.5,False,2026-03-06T21:11:25,2026-03-06T21:11:25
218471485,10,76561198879362475,14,14,2026-01-12T10:52:45,english,"Nostalgic , who is here remember the Local network ?",True,0,0,0.5,False,2026-02-16T17:13:06,2026-02-16T17:13:06
218297138,10,76561198740587677,203,78,2026-03-09T14:33:46,english,this game is so good im gonna bust my nuh while playing ts,True,1,0,0.523809552192688,False,2026-02-14T14:33:53,2026-02-14T14:33:53
219953922,10,76561198189636034,1873,1873,2026-01-19T07:34:52,english,i can install femboy socks mod 10/10 game would buy again,True,0,0,0.5,False,2026-03-06T07:08:00,2026-03-06T07:08:00
218825246,10,76561198081404449,3347,1437,2026-03-13T03:42:06,english,this is decent but condition zero is better,True,1,0,0.52173912525177,False,2026-02-21T02:41:30,2026-02-21T02:41:30
219003898,10,76561199471288183,591,575,2026-03-05T21:07:26,english,"Navukao sam se na igricu, ka' cigance na sokic iz tetrapaka :3",True,1,0,0.523809552192688,False,2026-02-23T01:30:58,2026-02-23T01:30:58
220022826,10,76561197968331182,26188,26188,2026-03-05T06:19:13,english,Greatest in the universe.,True,0,0,0.5,False,2026-03-06T23:11:40,2026-03-06T23:11:40
218518294,10,76561197993000525,33,33,2026-02-06T16:28:31,english,"best game 4 ever, never forget",True,0,0,0.5,False,2026-02-17T07:12:07,2026-02-17T07:12:07
218112648,10,76561199581724494,422,351,2026-02-15T11:09:32,english,Ts is So ♥♥♥♥♥♥♥ masterpiece that i almost throw my pc,True,0,0,0.5,False,2026-02-12T01:08:40,2026-02-12T01:08:57
218779267,10,76561199029335857,241,187,2026-03-06T16:37:59,english,easy to learn and you can play in school,True,0,0,0.5,False,2026-02-20T15:59:44,2026-02-20T15:59:44
219470447,10,76561198853745901,778,611,2026-03-02T23:12:48,english,"как игрок с ником ВалераКоленвал89 , одобряю!!!!!!",True,0,0,0.5,False,2026-02-28T20:23:31,2026-02-28T20:23:31
218479054,10,76561199733435223,180,180,2026-02-16T19:03:27,english,very good game legendary game for ogs!,True,0,0,0.5,False,2026-02-16T19:03:46,2026-02-16T19:03:46
218801961,10,76561199366269757,468,453,2026-03-06T22:23:50,english,es una mierda de juego pero le tengo cariño jasjas,True,0,0,0.5,False,2026-02-20T20:39:14,2026-02-20T20:39:14
218531997,10,76561198209226165,524,441,2026-02-23T09:38:33,english,"je to lepší než ta nová sračka
",True,0,0,0.5,False,2026-02-17T13:06:40,2026-02-17T13:06:40
219940324,10,76561198094624706,25,25,2017-05-29T08:33:38,english,1.6 walked so all the other CS' could run,True,3,0,0.5454545617103577,False,2026-03-06T03:17:02,2026-03-06T03:17:02
220369046,10,76561198007323072,49608,49608,2011-11-12T09:00:00,english,Miss 1.6 - newer ones can't really compare.,True,0,0,0.5,False,2026-03-10T19:48:41,2026-03-10T19:48:41
219055964,10,76561198759374196,2051,151,2026-03-07T15:51:06,english,yeah good game/good aim/good fps,True,0,0,0.5,False,2026-02-23T18:22:12,2026-02-23T18:22:12
219798652,10,76561198886350950,701,461,2026-03-11T18:53:47,english,by far the best community i've ever seen.,True,0,0,0.5,False,2026-03-04T15:14:39,2026-03-04T15:14:39
219606273,10,76561197967147187,203,183,2026-03-02T04:51:26,english,latam memey wacky chaos servers r the best 😹😹🙀😻,True,0,0,0.5,False,2026-03-02T04:30:27,2026-03-02T04:30:27
219492100,10,76561198208745784,143,143,2026-01-11T20:10:41,english,"Who knows, who knows that this game is the og",True,0,0,0.5,False,2026-03-01T00:58:29,2026-03-01T00:58:29
219843694,10,76561198148795889,53,53,2019-09-25T18:51:19,english,"Plz add support IPv6 to Gold Source Engine
",True,0,0,0.5,False,2026-03-05T01:35:44,2026-03-05T01:35:44
218407348,10,76561199805966585,1164,1054,2026-03-07T20:35:47,english,zajebista gra tylko boomerzy w nią grają,True,0,0,0.5,False,2026-02-15T20:09:51,2026-02-15T20:09:51
219839599,10,76561197963764540,4638,774,2026-03-09T14:30:34,english,Fun classic game.,True,0,0,0.5,False,2026-03-05T00:20:22,2026-03-05T00:20:22
