id,gameId,authorSteamId,authorPlaytimeForever,authorPlaytimeAtReview,authorLastPlayed,language,review,votedUp,votesUp,votesFunny,weightedVoteScore,writtenDuringEarlyAccess,timestampCreated,timestampUpdated
219615411,10,76561198294460381,47,47,2026-01-26T17:35:17,english,The best game that i have ever played,True,0,0,0.5,False,2026-03-02T07:52:39,2026-03-02T07:52:39
218567883,10,76561199203363822,1336,1290,2026-02-22T22:38:43,english,"the best game better then cs2
",True,0,0,0.5,False,2026-02-17T22:18:42,2026-02-17T22:18:42
219661026,10,76561197960378179,236366,235307,2026-03-12T19:30:19,english,Great FPS Shooter ! Never a waste !,True,2,0,0.523809552192688,False,2026-03-02T21:32:33,2026-03-02T21:32:33
220350055,10,76561198755638524,750,745,2026-03-11T12:10:47,english,lets me scream racial slurs at random people,True,0,1,0.5,False,2026-03-10T15:01:42,2026-03-10T15:01:42
219045177,10,76561199791085632,622,622,2026-02-22T13:43:12,english,"Good! In fact, i love it!",True,0,0,0.5,False,2026-02-23T15:40:30,2026-02-23T15:40:30
218966006,10,76561197968943091,50818,50818,2011-07-14T09:00:00,english,one of the most memorable games in my life,True,0,0,0.5,False,2026-02-22T16:58:41,2026-02-22T16:58:41
218800016,10,76561198737516744,1578,1413,2026-02-22T19:42:50,english,Best game ever created!,True,0,0,0.5,False,2026-02-20T20:21:47,2026-02-20T20:21:47
218769338,10,76561198834885120,78735,78735,2026-03-01T23:02:40,english,loved playing it and still enjoying it <3,True,0,0,0.5,False,2026-02-20T13:20:09,2026-03-01T23:37:26
219504721,10,76561198124298169,8788,8358,2026-03-10T06:20:26,english,Peak childhood game,True,2,0,0.523809552192688,False,2026-03-01T04:20:38,2026-03-01T04:20:38
219146783,10,76561198060329794,63998,63536,2026-03-12T21:31:31,english,one of the best games ever made!,True,1,0,0.5007396936416626,False,2026-02-24T21:48:44,2026-02-24T21:48:44
220317603,10,76561198109141915,403,260,2026-03-12T13:51:51,english,"Absolute classic.

""https://gamebanana.com/mods/560488"" for bots.

Have fun o7",True,0,0,0.5,False,2026-03-10T02:25:19,2026-03-10T02:25:19
219509056,10,76561197991039919,9921,8235,2026-03-13T09:55:18,english,Best OG 1st shooter Game!,True,0,0,0.5,False,2026-03-01T05:31:26,2026-03-01T05:31:26
218709120,10,76561199132597140,1162,1106,2026-02-20T21:33:35,english,very good game bro,False,0,0,0.5,False,2026-02-19T17:45:33,2026-02-19T17:45:33
218557877,10,76561197998886923,1749,1230,2026-03-01T13:25:24,english,PLEASE REMASTER THIS GAME!!! SO MUCH FUN !!! <3 <3 <3 <3 <3,True,0,0,0.5,False,2026-02-17T19:48:23,2026-02-17T19:48:23
218160044,10,76561199122976248,51863,48496,2026-03-12T20:19:51,english,the best game I've ever played :3,True,0,0,0.5,False,2026-02-12T18:13:11,2026-02-12T18:13:11
219575000,10,76561197963742406,21746,18794,2026-03-12T23:34:34,dutch,This game own.... IT OWNSSSS doug,True,0,0,0.5,False,2026-03-01T20:32:56,2026-03-01T20:32:56
220318869,10,76561198976062541,45,45,2025-06-10T22:02:39,english,game runs bad,False,0,2,0.4761904776096344,False,2026-03-10T02:52:09,2026-03-10T02:52:09
219473834,10,76561199826508423,372,287,2026-03-03T22:04:34,english,"classic, the GOAT.",True,1,0,0.523809552192688,False,2026-02-28T21:03:07,2026-02-28T21:03:07
220490230,10,76561199709444235,21890,21670,2026-03-12T22:57:09,english,best game forever!!!,True,0,0,0.5,False,2026-03-12T14:10:34,2026-03-12T14:10:34
220079928,10,76561198276048690,97,97,2026-03-07T14:02:28,english,ez game this poopoo to easy,True,0,0,0.5,False,2026-03-07T14:17:05,2026-03-07T14:17:05
219796486,10,76561198876149741,5679,2872,2026-03-13T00:39:33,english,Goated game,True,0,0,0.5,False,2026-03-04T14:48:22,2026-03-04T14:48:22
219558544,10,76561199161276941,356,292,2026-03-07T17:03:38,english,best game oat,True,0,0,0.5,False,2026-03-01T17:26:03,2026-03-01T17:26:03
219381154,10,76561198873972516,598,531,2026-03-12T19:14:18,english,good game,True,0,0,0.5,False,2026-02-27T22:25:30,2026-02-27T22:25:30
219328925,20,76561197974101766,121,121,2026-02-26T13:08:02,english,"Fast paced team shooter where each character brings a distinct flair, and battles are filled with humor and friendly rivalry. Dive into chaotic fun with a grin!",True,4,1,0.5735607743263245,False,2026-02-27T09:33:10,2026-02-27T09:33:10
218052481,20,76561198101903640,1121,1033,2026-02-14T05:19:58,english,small but dedicated community. still very enjoyable today. better than overwatch,True,3,0,0.5535714626312256,False,2026-02-11T05:13:16,2026-02-11T05:13:16
219196299,20,76561198781788881,414,246,2026-03-12T01:23:18,english,"Game is fun. If you want to play by yourself with bots then you will need to download a mod so you can add bots in the game. I believe the one I remember from couple years ago was called FoxBot. If you decide to play with random people then be warned that these guys (or at least a few of them) sweat their balls off in this game, so prepare to die quite a bit.",True,3,1,0.5495495200157166,False,2026-02-25T14:40:38,2026-02-25T14:40:38
219039119,20,76561197963509451,17490,17212,2026-02-23T18:34:46,english,"Team Fortress Classic is pure old-school multiplayer chaos. It’s fast, simple, and all about teamwork. Each class has a clear role, and matches can get crazy really fast, especially on classic maps like 2Fort.

The movement feels quick, rocket jumps are fun, and the gameplay rewards coordination more than just aim. It doesn’t have the personality or polish of newer class-based shooters, but it has that nostalgic late-90s vibe that makes it special.

Of course, it’s old. The graphics are basic, the menus are outdated, and finding active servers can be harder now. But if you enjoy classic FPS games, it’s still a fun experience.

Pros: fast gameplay, strong class roles, nostalgic multiplayer vibe
Cons: outdated graphics, smaller player base

Overall, Team Fortress Classic is a piece of FPS history. Not for everyone today, but still fun if you like old-school multiplayer.",True,3,0,0.5495495200157166,False,2026-02-23T14:01:40,2026-02-23T14:01:40
218783673,20,76561199152493299,123,119,2026-02-28T09:31:37,english,"this game is amazing and I'm tired to pretend it's not





Also it runs at like 12 fps because I powerlocked my cpu at 30%",True,5,0,0.5456260442733765,False,2026-02-20T17:01:19,2026-02-20T17:01:19
218461827,20,76561199222938918,25,25,2025-12-21T07:17:39,english,i mean it's fun for the first like 20 minutes but doesn't mean it's NOT fun. i guarantee your playtime in just over a year will be under an hour or two,True,3,0,0.52222740650177,False,2026-02-16T14:36:34,2026-02-16T14:36:34
218122222,20,76561198799616739,5416,5380,2026-02-21T04:47:40,english,"TF2 except with better and more skilled movement, faster paced, grenades, cooler maps, cooler gamemodes, 10 classes, no ♥♥♥♥♥♥♥ new weapons, no ♥♥♥♥♥♥♥ hats, better artstyle, no pyro mains (which means no ♥♥♥♥♥♥♥♥ and furries) and significantly less hackers. Basically, Team Fortress for real negroes",True,5,1,0.5071881413459778,False,2026-02-12T04:37:01,2026-02-12T04:37:01
219936173,20,76561198789892209,321,167,2026-03-12T00:35:38,english,"half life deathmach but it with a slight taste off cs 1.6.
in short its perfect
in long, it joins the best pat off my favorite games: the half life movement,the cs team objectives and the chaos off a tf2 lobby",True,0,0,0.5,False,2026-03-06T02:10:40,2026-03-08T19:24:35
218347699,20,76561199086686178,22,22,2024-12-05T04:35:41,english,Unfortunately the servers are completely dead. 0 actual humans after 22 minutes straight of looking for people. not great for a multiplayer only game,False,5,3,0.489990234375,False,2026-02-15T03:22:21,2026-02-15T03:25:21
219022395,20,76561198192685183,33,33,2021-01-12T20:13:49,english,"I understand that when you get drawn in by a sequel you become curious about previous entries but don't bother with this one. If you can even find a server you will only find enjoyment if you're a fossil, masochist, or a contrarian.",False,2,2,0.41935956478118896,False,2026-02-23T08:08:07,2026-02-23T08:08:07
218865959,20,76561199574465571,21,21,2025-05-24T01:52:34,english,I can no longer get steam points from awards because VALVe changed it.,False,0,1,0.454054057598114,False,2026-02-21T15:14:47,2026-02-21T15:14:47
218233464,20,76561198333627194,33,11,2026-02-13T19:00:15,english,It's still plain stupid fun even if TF2 surpasses it in every way.,True,7,0,0.6178228259086609,False,2026-02-13T18:44:34,2026-02-13T18:44:34
220182820,20,76561197973727668,41200,41200,2026-03-07T19:34:19,english,"Awesome game, old school first person shooter. this was one of the first team based shooters out. ive spent many hours playing this even before there was a Steam app. played this when you had to have a WON id.",True,1,0,0.5,False,2026-03-08T14:23:03,2026-03-08T14:23:03
219852046,20,76561198212121196,456,456,2026-03-01T02:49:33,english,"Variação interessante do CS. Quem curte o original, consegue se divertir também com esse mod.",True,1,0,0.5,False,2026-03-05T04:18:01,2026-03-05T04:18:01
218334461,20,76561199869483647,205,201,2026-02-28T23:40:50,english,Honestly glad to see some people still play the original,True,0,0,0.5,False,2026-02-14T23:17:09,2026-02-14T23:17:09
218912233,20,76561197961561020,69673,69651,2026-03-01T23:15:03,english,Been playing for over 25 years,True,2,0,0.5454545617103577,False,2026-02-22T01:49:03,2026-02-22T01:49:03
220479963,20,76561199111456640,6,6,2026-03-12T10:06:10,english,it fine,True,0,0,0.5,False,2026-03-12T10:07:13,2026-03-12T10:07:13
220231216,20,76561199507428632,18,18,2025-12-12T10:01:46,english,good gaem,True,0,0,0.5,False,2026-03-09T00:22:05,2026-03-09T00:22:05
218921669,20,76561197963478901,301,301,2026-02-22T03:24:22,english,You know what it is.,True,0,0,0.5,False,2026-02-22T04:44:37,2026-02-22T04:44:37
218622878,20,76561198765518390,17,17,2026-01-07T01:11:21,english,underrated gem,True,0,0,0.5,False,2026-02-18T14:52:55,2026-02-18T14:52:55
219847827,20,76561199484907023,11,11,2025-09-01T21:33:44,english,boring,False,0,0,0.36410924792289734,False,2026-03-05T02:57:17,2026-03-05T02:57:17
218627938,20,76561199092683597,2273,2273,2025-02-14T01:42:08,english,absolute BANGER,True,0,0,0.5,False,2026-02-18T16:15:06,2026-02-18T16:15:06
219632863,20,76561199811983672,587,559,2026-03-04T01:41:48,english,it is really good.,True,1,0,0.5,False,2026-03-02T14:29:04,2026-03-02T14:29:04
220270144,20,76561199888412292,210,210,2026-03-09T13:07:14,english,"viva el porno
",True,1,0,0.523809552192688,False,2026-03-09T13:50:20,2026-03-09T13:50:20
218070261,20,76561199218923270,35,35,2023-12-18T07:42:59,english,fortnress,True,0,0,0.5,False,2026-02-11T12:50:23,2026-02-11T12:50:23
219816120,20,76561198074584281,157,139,2026-03-10T15:38:51,english,basicly the prequell for tf2,True,1,2,0.5,False,2026-03-04T18:49:44,2026-03-04T18:49:44
218963150,20,76561198771832100,8332,6023,2026-03-08T12:41:01,english,"ес
",True,0,0,0.4761904776096344,False,2026-02-22T16:24:04,2026-02-22T16:24:04
218645702,20,76561199616131767,239,203,2026-02-20T19:59:54,english,xgzfhfxg,True,0,0,0.5,False,2026-02-18T20:38:27,2026-02-18T20:38:27
218516162,20,76561197985740355,146,146,2022-04-30T08:09:32,english,.,False,1,0,0.5,False,2026-02-17T06:16:49,2026-02-17T06:16:49
214026898,20,76561199561558068,44,30,2025-12-23T20:52:06,english,"Since no one on TF community will read this review, I wish to the community, that includes the vets that has been playing on steam since 2003, Merry christmas and happy new year. <3.",True,82,5,0.8642882108688354,False,2025-12-23T20:57:27,2025-12-23T20:57:27
216222973,20,76561197967843195,722,602,2026-02-18T21:40:55,english,There' like 30 people in the world playing and they are all degenerates. Makes it fun.,True,36,12,0.8010588884353638,False,2026-01-18T05:52:58,2026-01-18T05:52:58
214194667,20,76561199045396050,6394,4936,2026-02-22T19:18:28,english,"This game is publicly ""dead,"" as the kids say. However, if you play with large groups of friends and/or are willing to find the right online communities, it's a very fun time. Compared to TF2, which I'm sure is what people are checking reviews to see, it's functionally way jankier, has an infinitely higher skill curve, and is far less customisable. It also has a community of approximately 20 people, 4 gnats, and a ball of lint. Despite this, it has a great variety of potential playstyles and game modes (both official and fan-made) going for it despite what may appear at first glance to be barely anything. A fun game for people who want to find a new niche community to bond over a dorky interest with. I'd say the gameplay itself is more serious and competitive than a TF2 match with friends while the community is more goofy and closely connected than TF2's.",True,18,5,0.7161446213722229,False,2025-12-26T00:32:53,2025-12-26T00:32:53
216819403,20,76561198106043079,46,46,2023-06-22T01:42:32,english,"The original before the iconic sequel.  I was surprised no one ever talked about Team Fortress 1, so I decided to try it out to see if there was anything being missed.  Sadly, there is not, which isn't to say this is a bad or even cheap game, but whatever it started, TF2 perfected in terms of writing and gameplay.  Still good to check it out for anyone who cares about the history of gaming.",True,8,0,0.6296296119689941,False,2026-01-26T02:38:26,2026-01-26T02:38:26
213753008,20,76561199153363015,420,195,2026-03-01T19:54:14,english,"Got this wanting to see the history of Tf2, and this is a very different experience. Very fun tho and i'm suprised it has been alive for so long. the players who DO play it are gods

",True,7,1,0.6108291149139404,False,2025-12-20T19:47:53,2025-12-20T19:47:53
216996429,20,76561199210587622,18,18,2026-01-28T04:38:58,english,"Pretty enjoyable, the community still keeps servers alive. Don't buy the game on its own, buy it via Valve Complete Pack.",True,8,1,0.5902372598648071,False,2026-01-28T04:39:54,2026-01-28T04:39:54
214723392,20,76561198176679763,6,6,2025-12-31T11:17:43,english,"part of the Half-Life 1 Anthology, that's why I got it, cool to try, but no reason really to stick to it, given my lack of nostalgia over this",True,6,0,0.58888840675354,False,2025-12-31T11:19:34,2025-12-31T11:19:34
219328925,20,76561197974101766,121,121,2026-02-26T13:08:02,english,"Fast paced team shooter where each character brings a distinct flair, and battles are filled with humor and friendly rivalry. Dive into chaotic fun with a grin!",True,4,1,0.5735607743263245,False,2026-02-27T09:33:10,2026-02-27T09:33:10
216307834,20,76561199814863578,430,430,2026-01-19T06:14:42,english,It's not a cartoonish as TF2 but is still great for multiplayer so yes it's a great game to play,True,3,0,0.5652173757553101,False,2026-01-19T06:15:30,2026-01-19T06:15:30
218052481,20,76561198101903640,1121,1033,2026-02-14T05:19:58,english,small but dedicated community. still very enjoyable today. better than overwatch,True,3,0,0.5535714626312256,False,2026-02-11T05:13:16,2026-02-11T05:13:16
219196299,20,76561198781788881,414,246,2026-03-12T01:23:18,english,"Game is fun. If you want to play by yourself with bots then you will need to download a mod so you can add bots in the game. I believe the one I remember from couple years ago was called FoxBot. If you decide to play with random people then be warned that these guys (or at least a few of them) sweat their balls off in this game, so prepare to die quite a bit.",True,3,1,0.5495495200157166,False,2026-02-25T14:40:38,2026-02-25T14:40:38
219039119,20,76561197963509451,17490,17212,2026-02-23T18:34:46,english,"Team Fortress Classic is pure old-school multiplayer chaos. It’s fast, simple, and all about teamwork. Each class has a clear role, and matches can get crazy really fast, especially on classic maps like 2Fort.

The movement feels quick, rocket jumps are fun, and the gameplay rewards coordination more than just aim. It doesn’t have the personality or polish of newer class-based shooters, but it has that nostalgic late-90s vibe that makes it special.

Of course, it’s old. The graphics are basic, the menus are outdated, and finding active servers can be harder now. But if you enjoy classic FPS games, it’s still a fun experience.

Pros: fast gameplay, strong class roles, nostalgic multiplayer vibe
Cons: outdated graphics, smaller player base

Overall, Team Fortress Classic is a piece of FPS history. Not for everyone today, but still fun if you like old-school multiplayer.",True,3,0,0.5495495200157166,False,2026-02-23T14:01:40,2026-02-23T14:01:40
218783673,20,76561199152493299,123,119,2026-02-28T09:31:37,english,"this game is amazing and I'm tired to pretend it's not





Also it runs at like 12 fps because I powerlocked my cpu at 30%",True,5,0,0.5456260442733765,False,2026-02-20T17:01:19,2026-02-20T17:01:19
216524453,20,76561199698352336,322,264,2026-02-21T20:01:14,english,"The game is very fun when i bought the half life bundle that came with it, although the server s only have been run by bots and rarely players playing but this game is still fun",True,2,0,0.54356849193573,False,2026-01-22T07:41:24,2026-01-22T07:41:24
215343827,20,76561198374772275,52,52,2025-08-24T16:26:52,english,"Good old one, but don!t buy it, only if you buy the Vavle pack.",True,1,0,0.523809552192688,False,2026-01-06T21:17:42,2026-01-06T21:17:42
218461827,20,76561199222938918,25,25,2025-12-21T07:17:39,english,i mean it's fun for the first like 20 minutes but doesn't mean it's NOT fun. i guarantee your playtime in just over a year will be under an hour or two,True,3,0,0.52222740650177,False,2026-02-16T14:36:34,2026-02-16T14:36:34
215064773,20,76561198322379889,221,218,2026-01-05T01:40:52,english,"Team Fortress Classic is a pivotal piece of gaming history whose influence far exceeds its modern playability. As the foundation for the class-based shooter genre, its DNA is visible everywhere today. Yet, returning to it now reveals a game that is equal parts charming, raw, and frustratingly dated.

Strengths: Pure, Archetypal Design
Long before ""hero shooters,"" TFC established the iconic class roster—Scout, Soldier, Heavy, Medic, and others—that remains a blueprint. Each role is distinct and mechanically pure. The exhilaration of the Scout’s speed, the skill-ceiling of rocket jumping, and the mind-games of the Spy still shine. Its simplicity is a virtue: objectives are clear, combat is swift, and there’s a refreshing lack of modern clutter like unlocks or microtransactions. It’s pure, skill-based gameplay.

Weaknesses: Dated and Unforgiving
However, that simplicity feels archaic today. Movement is fast but lacks polish, weapon feedback is weak, and the GoldSrc engine shows its age in blocky visuals and sparse audio. Map design, while iconic, often relies on choke points and narrow corridors, leading to defensive stalemates—especially against stacked Engineer sentries. Balance feels harsh and inconsistent by modern standards, with certain classes (Heavy, Sniper) easily tipping matches depending on context. The game demands coordination, yet public play often devolves into chaotic or stagnant bouts.

Verdict
Team Fortress Classic is an essential historical artifact that genre fans should experience. Its core class design is brilliant and influential. However, as a modern multiplayer experience, it’s held back by dated mechanics, technical limitations, and uneven pacing. The score of 6/10 reflects this divide: immense respect for its legacy, but a clear-eyed acknowledgment that it’s more a museum piece than a living game for most players.",True,2,0,0.52173912525177,False,2026-01-03T23:23:32,2026-01-03T23:23:32
214538104,20,76561198179068679,88,88,2025-12-23T20:38:15,english,"I played it for a little bit and I actually had a bit of fun, apparently people still play this one. It was cool to see what Team Fortress 2 was built upon, but other than that I have no reason to play this over the sequel. I only recommend it if you're curious about it and you got it from the Half Life or Valve bundle.",False,9,0,0.5182996392250061,False,2025-12-29T13:32:17,2025-12-29T13:32:17
218122222,20,76561198799616739,5416,5380,2026-02-21T04:47:40,english,"TF2 except with better and more skilled movement, faster paced, grenades, cooler maps, cooler gamemodes, 10 classes, no ♥♥♥♥♥♥♥ new weapons, no ♥♥♥♥♥♥♥ hats, better artstyle, no pyro mains (which means no ♥♥♥♥♥♥♥♥ and furries) and significantly less hackers. Basically, Team Fortress for real negroes",True,5,1,0.5071881413459778,False,2026-02-12T04:37:01,2026-02-12T04:37:01
217416925,20,76561199878528440,14,14,2025-10-05T08:42:44,english,Well I only got it from a pack but it was nice to meet the people who never moved on from tfclassic,True,1,0,0.5049504637718201,False,2026-02-02T12:41:54,2026-02-02T12:41:54
219936173,20,76561198789892209,321,167,2026-03-12T00:35:38,english,"half life deathmach but it with a slight taste off cs 1.6.
in short its perfect
in long, it joins the best pat off my favorite games: the half life movement,the cs team objectives and the chaos off a tf2 lobby",True,0,0,0.5,False,2026-03-06T02:10:40,2026-03-08T19:24:35
216039685,20,76561199822648813,66,43,2026-02-03T21:56:58,english,"9/10 game but still pretty solid in 2026 (maybe 2027 hell even 2030!)
now i do recommend getting bots since the servers are dead but whatever
basically quakefortress/tf2 but in goldsource
so yuh!!!!",True,0,0,0.5,False,2026-01-15T21:56:23,2026-01-15T21:56:23
215259005,20,76561198124551058,24,24,2023-04-04T22:53:48,english,its nice to have in the library. but i suck at it and i never play. what i have its like 6-7/10 at best. just play 2. unless trying to see history.,False,0,0,0.5020576119422913,False,2026-01-05T22:07:54,2026-02-11T09:36:09
214553663,20,76561199802706660,390,367,2026-03-01T05:51:35,english,pretty fun trip if you like tf2 and half life and is basically just a better version of quake fortress the gameplay is fun and oddly the capture the flag is more fun in tfc then tf2 also vip mode is goated,True,0,0,0.5,False,2025-12-29T17:00:06,2025-12-29T17:00:06
214504285,20,76561199842683993,187,44,2026-02-04T00:59:00,english,"even if i'm five frames behind everyone, the amount of euphoria i feel sniping a bunny hopping scout",True,0,0,0.5,False,2025-12-29T03:20:45,2025-12-29T03:20:45
214354062,20,76561199181825643,45,31,2025-12-28T08:46:36,english,"Pretty good for Nostalgic reason, however it has a different aim from TF2 and there's very few players here and it's normal. 

Ignoring the graphics since this is an old game.",True,0,0,0.5,False,2025-12-27T17:37:36,2025-12-27T17:37:36
215146459,20,76561199179904303,436,436,2024-06-24T14:20:13,english,"OK, but Team Fortress 2 is better and still alive.",True,2,0,0.5454545617103577,False,2026-01-04T19:02:05,2026-01-04T19:02:05
218347699,20,76561199086686178,22,22,2024-12-05T04:35:41,english,Unfortunately the servers are completely dead. 0 actual humans after 22 minutes straight of looking for people. not great for a multiplayer only game,False,5,3,0.489990234375,False,2026-02-15T03:22:21,2026-02-15T03:25:21
217279141,20,76561198335658216,515,515,2026-01-31T20:28:16,english,"Outclassed by TF2 in every way, but it's still neat I suppose.",True,0,1,0.4761904776096344,False,2026-01-31T20:29:36,2026-02-10T20:50:27
216729585,20,76561199569888267,279,279,2026-02-07T11:01:15,english,"underrated, but hits harder than me on the toilet having explosive diarrhea after eating Taco Bell's ""Beef Melt""",True,0,0,0.5,False,2026-01-25T01:03:17,2026-01-25T01:03:17
213665568,20,76561198830855021,21,21,2025-12-19T19:56:13,english,"The only reason I bought this is because it's for some reason in ""Half-Life Complete"" bundle. Not only it's nearly empty, so all you can do is to play with bots but also it's just a much worse version of TF2. Wish I could refund this.",False,1,6,0.4383469820022583,False,2025-12-19T20:03:47,2025-12-19T20:03:47
219022395,20,76561198192685183,33,33,2021-01-12T20:13:49,english,"I understand that when you get drawn in by a sequel you become curious about previous entries but don't bother with this one. If you can even find a server you will only find enjoyment if you're a fossil, masochist, or a contrarian.",False,2,2,0.41935956478118896,False,2026-02-23T08:08:07,2026-02-23T08:08:07
218865959,20,76561199574465571,21,21,2025-05-24T01:52:34,english,I can no longer get steam points from awards because VALVe changed it.,False,0,1,0.454054057598114,False,2026-02-21T15:14:47,2026-02-21T15:14:47
216109197,20,76561197966178044,10210,10209,2026-01-16T21:57:43,english,One of the best multiplayer games in the world.,True,3,0,0.5236262083053589,False,2026-01-16T21:55:00,2026-01-16T21:55:00
218233464,20,76561198333627194,33,11,2026-02-13T19:00:15,english,It's still plain stupid fun even if TF2 surpasses it in every way.,True,7,0,0.6178228259086609,False,2026-02-13T18:44:34,2026-02-13T18:44:34
215244475,20,76561199812158303,48,48,2025-10-25T03:44:07,english,tf2 but  gold src and without anything that makes tf2 good,True,0,0,0.4761904776096344,False,2026-01-05T19:09:16,2026-01-05T19:09:16
217907236,20,76561199507503618,25,25,2026-02-09T01:28:00,english,fun game needs to be revived lower price bc 5 dollar for 1999 game,True,1,0,0.523809552192688,False,2026-02-09T01:32:55,2026-02-09T01:33:00
220182820,20,76561197973727668,41200,41200,2026-03-07T19:34:19,english,"Awesome game, old school first person shooter. this was one of the first team based shooters out. ive spent many hours playing this even before there was a Steam app. played this when you had to have a WON id.",True,1,0,0.5,False,2026-03-08T14:23:03,2026-03-08T14:23:03
