id,gameId,authorSteamId,authorPlaytimeForever,authorPlaytimeAtReview,authorLastPlayed,language,review,votedUp,votesUp,votesFunny,weightedVoteScore,writtenDuringEarlyAccess,timestampCreated,timestampUpdated
214973546,2820,76561199048637065,497,497,2026-01-03T01:58:32,english,I like the exploring aspect of the game.,True,0,0,0.5,False,2026-01-03T01:59:07,2026-01-03T01:59:07
218785157,2820,76561198001039840,15301,15295,2026-02-20T17:36:14,english,wonderfully detailed,True,0,0,0.4761904776096344,False,2026-02-20T17:22:17,2026-02-20T17:22:17
213255278,2820,76561199890637694,8720,3236,2026-03-09T08:54:57,english,Very entertaining,True,0,0,0.5,False,2025-12-14T07:04:07,2025-12-14T07:04:07
217586858,2820,76561198141061985,16,16,2026-02-04T22:45:37,english,"This has got to be some sort of joke. This does NOT have controller support despite literally showing a controller schematic in game. Also, no idea how to turn the music down (tried many different ways in volume music but nothing worked 🙃) which would be REALLY nice because someone decided the music is vastly more important to hear than whatever the narrator is trying to say. Literally can’t hear what they’re saying at all.",False,1,2,0.5243619084358215,False,2026-02-04T22:50:32,2026-02-04T22:50:32
213321839,2820,76561198390037981,11622,11613,2025-12-31T21:32:42,english,"DO NOT TRY TO PLAY THIS GAME ON STEAM.  They offer almost no support.  This game is Buggy as hell.  The game maker knows this and they have posted about 6 mods and fixes.  Each one of those mods and fixes says: ""This will not work with Steam. ""  About 100 hours into the game you discover it is broken.  I asked for a refund but Steam said ""Uh... you have already played 100 hours.  Yes. I wanted 100 hours on a game that worked.  You can take my refund and shove it Steam.   Buy the game online by a reputable dealer.",False,13,9,0.5186784863471985,False,2025-12-15T01:50:04,2025-12-15T01:50:04
213183653,2820,76561198089072911,145,103,2025-12-13T12:58:36,english,"what I don't like about X games is that sometimes you just have to grind through boring stuff x(

but it's a great game non the less",True,1,0,0.5161290764808655,False,2025-12-13T10:53:35,2025-12-13T10:53:35
216498776,2820,76561198076378579,16,16,2026-01-21T21:54:21,english,This is almost identical to the first game with the same problems of having aged poorly. The ship controls are very difficult to use and there is no tutorial. 20/100,False,0,1,0.5,False,2026-01-21T21:56:31,2026-01-21T21:56:31
214973546,2820,76561199048637065,497,497,2026-01-03T01:58:32,english,I like the exploring aspect of the game.,True,0,0,0.5,False,2026-01-03T01:59:07,2026-01-03T01:59:07
218785157,2820,76561198001039840,15301,15295,2026-02-20T17:36:14,english,wonderfully detailed,True,0,0,0.4761904776096344,False,2026-02-20T17:22:17,2026-02-20T17:22:17
213255278,2820,76561199890637694,8720,3236,2026-03-09T08:54:57,english,Very entertaining,True,0,0,0.5,False,2025-12-14T07:04:07,2025-12-14T07:04:07
217921087,2840,76561198367471798,850,850,2026-02-08T23:13:56,english,"X: Beyond the Frontier, developed and published by Egosoft, marks the beginning of a long-running space simulation series that would go on to define a particular niche of sandbox-driven, economy-focused gameplay. Released at the end of the 1990s, it arrived at a time when space simulators were either heavily combat-oriented or fading in popularity. Instead of following the fast-paced dogfighting model of many contemporaries, X: Beyond the Frontier chose a slower, more methodical path, emphasizing trading, economic systems, and open-ended exploration. The result is a game that feels less like a traditional action title and more like a living simulation of a complex interstellar society.

The narrative premise is straightforward but effective. Players assume the role of Kyle Brennan, a test pilot who becomes stranded in an unfamiliar region of space after an experimental jump drive malfunctions. Cut off from Earth and without immediate means of return, he must survive and adapt within a network of alien-controlled star systems. This setup provides context, but the story never aggressively dictates the pace of play. Instead, it functions as a loose thread woven into a much larger sandbox. The player is free to pursue narrative objectives or ignore them entirely, carving out their own path through commerce, exploration, and gradual expansion.

The true heart of X: Beyond the Frontier lies in its economic model. Each star system contains stations and factories that produce and consume specific resources, creating a dynamic supply-and-demand network. Players can buy goods where they are abundant and cheap, then transport them to sectors where they are scarce and valuable. Over time, profits allow for ship upgrades, better equipment, and eventually the construction of player-owned factories that generate income autonomously. This progression transforms the experience from a lone pilot scraping together credits into a budding industrial magnate influencing entire trade routes. The economic layer is surprisingly deep for its era, demanding attention to market fluctuations and logistical efficiency.

Combat exists but is not the primary focus. Encounters with pirates or hostile factions can occur, and upgrading shields and weapons becomes necessary for survival. However, dogfighting lacks the arcade immediacy found in more action-oriented space games. Battles tend to feel deliberate rather than frantic, reinforcing the broader theme that preparation and investment are more important than reflexes alone. In many cases, avoiding conflict or building enough economic power to outpace threats proves more rewarding than direct confrontation. This design choice underscores the simulation-driven philosophy at the game’s core.

Exploration plays a significant role in shaping the player’s journey. The universe is composed of numerous interconnected sectors linked by jump gates, each with distinct layouts and economic profiles. Discovering new systems often means uncovering fresh trading opportunities or encountering different factions with their own technologies and ships. The scale of the universe fosters a sense of isolation and curiosity, enhanced by ambient sound design and the quiet vastness of space. Unlike tightly scripted games, X: Beyond the Frontier allows long stretches of peaceful travel punctuated by moments of tension, mirroring the rhythms of real commerce and exploration.

Technically and visually, the game reflects its late-1990s origins. Ship models and station designs are simple by modern standards, and the interface can feel clunky to newcomers. Navigating menus, managing cargo, and issuing commands require patience, particularly for players accustomed to streamlined contemporary design. However, beneath the dated presentation lies a robust simulation that rewards dedication. The learning curve is steep, and early hours can feel slow or even confusing. Yet for those willing to invest time, the gradual mastery of systems and accumulation of wealth becomes deeply satisfying.

One of the game’s defining qualities is its emphasis on player autonomy. There are no rigid mission structures forcing progression, no scripted sequences dictating every action. Instead, X: Beyond the Frontier trusts players to set their own goals. Some may focus entirely on trading, others on exploration or incremental military strength. The emergent stories that arise—from narrowly escaping pirate ambushes to watching a newly built factory begin generating profit—often feel more personal and memorable than scripted events.

In retrospect, X: Beyond the Frontier stands as a foundational entry in the space simulation genre. It established the economic and sandbox framework that later entries in the X series would refine and expand upon. While its age is evident in both visuals and interface design, its ambition and systemic depth remain noteworthy. For players who appreciate open-ended progression, complex economic networks, and the quiet satisfaction of building an interstellar enterprise from humble beginnings, it offers a uniquely immersive experience. It is not a game of instant gratification, but rather one of patience, planning, and steady growth in a vast and indifferent universe.

Rating: 7/10",True,0,0,0.5,False,2026-02-09T07:38:03,2026-02-09T07:38:03
214296756,2840,76561197988688526,5733,469,2026-03-05T23:34:17,english,It's old but it's fun. Took a while to get some tweaks going but it looks great.,True,0,0,0.5,False,2025-12-27T02:56:22,2025-12-27T02:56:22
214929392,2840,76561198068120357,1937,1937,2024-12-05T20:01:21,english,true art,True,0,0,0.5,False,2026-01-02T17:04:18,2026-01-02T17:04:18
217921087,2840,76561198367471798,850,850,2026-02-08T23:13:56,english,"X: Beyond the Frontier, developed and published by Egosoft, marks the beginning of a long-running space simulation series that would go on to define a particular niche of sandbox-driven, economy-focused gameplay. Released at the end of the 1990s, it arrived at a time when space simulators were either heavily combat-oriented or fading in popularity. Instead of following the fast-paced dogfighting model of many contemporaries, X: Beyond the Frontier chose a slower, more methodical path, emphasizing trading, economic systems, and open-ended exploration. The result is a game that feels less like a traditional action title and more like a living simulation of a complex interstellar society.

The narrative premise is straightforward but effective. Players assume the role of Kyle Brennan, a test pilot who becomes stranded in an unfamiliar region of space after an experimental jump drive malfunctions. Cut off from Earth and without immediate means of return, he must survive and adapt within a network of alien-controlled star systems. This setup provides context, but the story never aggressively dictates the pace of play. Instead, it functions as a loose thread woven into a much larger sandbox. The player is free to pursue narrative objectives or ignore them entirely, carving out their own path through commerce, exploration, and gradual expansion.

The true heart of X: Beyond the Frontier lies in its economic model. Each star system contains stations and factories that produce and consume specific resources, creating a dynamic supply-and-demand network. Players can buy goods where they are abundant and cheap, then transport them to sectors where they are scarce and valuable. Over time, profits allow for ship upgrades, better equipment, and eventually the construction of player-owned factories that generate income autonomously. This progression transforms the experience from a lone pilot scraping together credits into a budding industrial magnate influencing entire trade routes. The economic layer is surprisingly deep for its era, demanding attention to market fluctuations and logistical efficiency.

Combat exists but is not the primary focus. Encounters with pirates or hostile factions can occur, and upgrading shields and weapons becomes necessary for survival. However, dogfighting lacks the arcade immediacy found in more action-oriented space games. Battles tend to feel deliberate rather than frantic, reinforcing the broader theme that preparation and investment are more important than reflexes alone. In many cases, avoiding conflict or building enough economic power to outpace threats proves more rewarding than direct confrontation. This design choice underscores the simulation-driven philosophy at the game’s core.

Exploration plays a significant role in shaping the player’s journey. The universe is composed of numerous interconnected sectors linked by jump gates, each with distinct layouts and economic profiles. Discovering new systems often means uncovering fresh trading opportunities or encountering different factions with their own technologies and ships. The scale of the universe fosters a sense of isolation and curiosity, enhanced by ambient sound design and the quiet vastness of space. Unlike tightly scripted games, X: Beyond the Frontier allows long stretches of peaceful travel punctuated by moments of tension, mirroring the rhythms of real commerce and exploration.

Technically and visually, the game reflects its late-1990s origins. Ship models and station designs are simple by modern standards, and the interface can feel clunky to newcomers. Navigating menus, managing cargo, and issuing commands require patience, particularly for players accustomed to streamlined contemporary design. However, beneath the dated presentation lies a robust simulation that rewards dedication. The learning curve is steep, and early hours can feel slow or even confusing. Yet for those willing to invest time, the gradual mastery of systems and accumulation of wealth becomes deeply satisfying.

One of the game’s defining qualities is its emphasis on player autonomy. There are no rigid mission structures forcing progression, no scripted sequences dictating every action. Instead, X: Beyond the Frontier trusts players to set their own goals. Some may focus entirely on trading, others on exploration or incremental military strength. The emergent stories that arise—from narrowly escaping pirate ambushes to watching a newly built factory begin generating profit—often feel more personal and memorable than scripted events.

In retrospect, X: Beyond the Frontier stands as a foundational entry in the space simulation genre. It established the economic and sandbox framework that later entries in the X series would refine and expand upon. While its age is evident in both visuals and interface design, its ambition and systemic depth remain noteworthy. For players who appreciate open-ended progression, complex economic networks, and the quiet satisfaction of building an interstellar enterprise from humble beginnings, it offers a uniquely immersive experience. It is not a game of instant gratification, but rather one of patience, planning, and steady growth in a vast and indifferent universe.

Rating: 7/10",True,0,0,0.5,False,2026-02-09T07:38:03,2026-02-09T07:38:03
214296756,2840,76561197988688526,5733,469,2026-03-05T23:34:17,english,It's old but it's fun. Took a while to get some tweaks going but it looks great.,True,0,0,0.5,False,2025-12-27T02:56:22,2025-12-27T02:56:22
214929392,2840,76561198068120357,1937,1937,2024-12-05T20:01:21,english,true art,True,0,0,0.5,False,2026-01-02T17:04:18,2026-01-02T17:04:18
218500909,2850,76561198367471798,814,814,2026-02-16T23:06:26,english,"X: Tension, developed and published by Egosoft, is a space simulation sandbox that significantly expands upon the framework established in its predecessor, X: Beyond the Frontier. Rather than functioning as a traditional sequel with a tightly scripted campaign, it acts as a large-scale evolution of the original concept, broadening the universe, increasing player freedom, and deepening economic and fleet management systems. The result is a title that prioritizes autonomy and systemic complexity over narrative guidance.

At its core, X: Tension places players in a vast interconnected galaxy composed of dozens of sectors, each governed by dynamic economic rules and populated by diverse factions. Unlike story-driven space games that funnel players toward fixed objectives, this title encourages self-directed progression. You are free to pursue commerce, piracy, bounty hunting, or large-scale economic expansion. The galaxy operates in real time, with goods being produced, transported, and consumed regardless of player involvement. This creates an ecosystem where supply and demand fluctuate organically, rewarding attentive traders who study market trends and identify profitable routes.

One of the most significant improvements over its predecessor is expanded ship accessibility. Players are no longer confined to a single vessel; instead, they can pilot a wide range of ships, from agile fighters to heavy transporters and freighters. Over time, this freedom extends into fleet management and station ownership. Establishing factories and production chains transforms the experience from simple trading into empire building. Constructing and defending your own industrial network adds strategic depth, as economic success must be balanced against threats from hostile factions and pirate activity.

Combat remains an integral but optional component of the experience. Dogfights occur in open 3D space, requiring careful maneuvering and energy management. Hostile factions such as the Xenon present ongoing dangers, particularly in border sectors. However, unlike pure action space shooters, combat here serves as part of a broader sandbox system. You may choose to avoid conflict entirely and focus on commerce, or you may invest heavily in military hardware to dominate contested regions. The game rarely forces a singular approach.

The interface and mechanics reflect the era of its release. Menus are dense and sometimes unintuitive, requiring patience to master. Yet beneath this complexity lies an intricate simulation system that rewards long-term investment. Learning how to manage automated traders, optimize supply chains, and monitor sector maps becomes part of the strategic appeal. The early hours can feel slow and methodical, but as wealth accumulates and fleets expand, the scale of operations grows dramatically.

Visually, X: Tension is unmistakably a product of the early 2000s, with modest ship models and relatively simple environmental textures. However, the sense of scale remains impressive. Vast starfields, distant nebulae, and the quiet hum of space travel create a contemplative atmosphere. Long trade routes and jump gate transitions reinforce the feeling of traversing a living galaxy rather than isolated mission zones. The soundtrack complements this tone with ambient compositions that emphasize exploration and solitude.

Narrative elements are minimal compared to the first game. While there is a loose framework connecting events in the X universe, the emphasis shifts strongly toward sandbox autonomy. Story moments exist primarily to provide context rather than dictate direction. This design philosophy makes the game particularly appealing to players who prefer emergent gameplay over scripted sequences.

Ultimately, X: Tension stands as a foundational entry in the X series that helped define Egosoft’s long-running formula. Its expansive economy, player-driven progression, and open-ended structure laid the groundwork for future installments. Though dated in presentation and occasionally opaque in interface design, it remains a compelling sandbox for players who appreciate deep simulation systems and the freedom to shape their own path through a living galaxy.

Rating: 7/10",True,0,0,0.4564315676689148,False,2026-02-17T00:45:44,2026-02-17T00:45:44
219456365,2850,76561198021719916,1223,924,2026-03-07T09:25:14,english,"Это хорошая игра, но у неё очень большие проблемы с актуальностью. Эта часть позиционируется чисто как песочница.
Тут нет сюжетки. Если вы хотите проходить сюжет игр по порядку, то пройдите сначала в X:BTF, а потом X2.
Если же хочется поиграть в песочницу, то лучше сразу X2 или более поздние части. QoL в X2 на намного выше X: Tension.

Плохую оценку игре ставить рука не поднимается, но сейчас я посоветую её пропустить в пользу более поздних частей.",True,0,0,0.5,False,2026-02-28T17:39:43,2026-02-28T17:39:43
218500909,2850,76561198367471798,814,814,2026-02-16T23:06:26,english,"X: Tension, developed and published by Egosoft, is a space simulation sandbox that significantly expands upon the framework established in its predecessor, X: Beyond the Frontier. Rather than functioning as a traditional sequel with a tightly scripted campaign, it acts as a large-scale evolution of the original concept, broadening the universe, increasing player freedom, and deepening economic and fleet management systems. The result is a title that prioritizes autonomy and systemic complexity over narrative guidance.

At its core, X: Tension places players in a vast interconnected galaxy composed of dozens of sectors, each governed by dynamic economic rules and populated by diverse factions. Unlike story-driven space games that funnel players toward fixed objectives, this title encourages self-directed progression. You are free to pursue commerce, piracy, bounty hunting, or large-scale economic expansion. The galaxy operates in real time, with goods being produced, transported, and consumed regardless of player involvement. This creates an ecosystem where supply and demand fluctuate organically, rewarding attentive traders who study market trends and identify profitable routes.

One of the most significant improvements over its predecessor is expanded ship accessibility. Players are no longer confined to a single vessel; instead, they can pilot a wide range of ships, from agile fighters to heavy transporters and freighters. Over time, this freedom extends into fleet management and station ownership. Establishing factories and production chains transforms the experience from simple trading into empire building. Constructing and defending your own industrial network adds strategic depth, as economic success must be balanced against threats from hostile factions and pirate activity.

Combat remains an integral but optional component of the experience. Dogfights occur in open 3D space, requiring careful maneuvering and energy management. Hostile factions such as the Xenon present ongoing dangers, particularly in border sectors. However, unlike pure action space shooters, combat here serves as part of a broader sandbox system. You may choose to avoid conflict entirely and focus on commerce, or you may invest heavily in military hardware to dominate contested regions. The game rarely forces a singular approach.

The interface and mechanics reflect the era of its release. Menus are dense and sometimes unintuitive, requiring patience to master. Yet beneath this complexity lies an intricate simulation system that rewards long-term investment. Learning how to manage automated traders, optimize supply chains, and monitor sector maps becomes part of the strategic appeal. The early hours can feel slow and methodical, but as wealth accumulates and fleets expand, the scale of operations grows dramatically.

Visually, X: Tension is unmistakably a product of the early 2000s, with modest ship models and relatively simple environmental textures. However, the sense of scale remains impressive. Vast starfields, distant nebulae, and the quiet hum of space travel create a contemplative atmosphere. Long trade routes and jump gate transitions reinforce the feeling of traversing a living galaxy rather than isolated mission zones. The soundtrack complements this tone with ambient compositions that emphasize exploration and solitude.

Narrative elements are minimal compared to the first game. While there is a loose framework connecting events in the X universe, the emphasis shifts strongly toward sandbox autonomy. Story moments exist primarily to provide context rather than dictate direction. This design philosophy makes the game particularly appealing to players who prefer emergent gameplay over scripted sequences.

Ultimately, X: Tension stands as a foundational entry in the X series that helped define Egosoft’s long-running formula. Its expansive economy, player-driven progression, and open-ended structure laid the groundwork for future installments. Though dated in presentation and occasionally opaque in interface design, it remains a compelling sandbox for players who appreciate deep simulation systems and the freedom to shape their own path through a living galaxy.

Rating: 7/10",True,0,0,0.4564315676689148,False,2026-02-17T00:45:44,2026-02-17T00:45:44
219456365,2850,76561198021719916,1223,924,2026-03-07T09:25:14,english,"Это хорошая игра, но у неё очень большие проблемы с актуальностью. Эта часть позиционируется чисто как песочница.
Тут нет сюжетки. Если вы хотите проходить сюжет игр по порядку, то пройдите сначала в X:BTF, а потом X2.
Если же хочется поиграть в песочницу, то лучше сразу X2 или более поздние части. QoL в X2 на намного выше X: Tension.

Плохую оценку игре ставить рука не поднимается, но сейчас я посоветую её пропустить в пользу более поздних частей.",True,0,0,0.5,False,2026-02-28T17:39:43,2026-02-28T17:39:43
220150307,2870,76561198045690153,2259,2259,2024-09-13T06:41:14,english,I wish i could give a maybe. I'm generally a vet of the X games and played them before i had a steam account. this is a fair departure from previous titles. while the player has limitations they nailed the atmosphere. stations feel outwardly alive albeit the npc models are horrendously ugly. I like options this doesn't  give you that in sandbox that feels more of an adventure pilot game. I still however find this title enjoyable for what it's worth.(side note) really wish they brought the station modules from rebirth to X4 lol.,True,0,0,0.5,False,2026-03-08T05:39:30,2026-03-08T05:39:30
